Id,PostId,Score,Text,CreationDate,UserDisplayName,UserId
"19533554","14111828","1","Thanks Tomas. Your answer cleared up a few doubts. As much as I like this feature, it remains mysterious to me. The lack of documentation (or even semantics) is the main problem.","2013-01-01 21:54:58","","634025"
"19533584","14114419","0","hey umm the last part that replaces the hyphens doesn't work, when I put this function on the site, it says that it has a null value... oh well, the first one is good enough, I hope 2 or 3 -- together don't make much of a difference.","2013-01-01 21:57:05","","2321939"
"19533610","14114419","0","Sorry! My bad, fixed in my answer, again. Haha!","2013-01-01 21:58:19","","1726801"
"19533620","14114419","1","PERFECT! thanks a million!","2013-01-01 21:59:19","","2321939"
"19533697","14114480","2","This is definitely the best formulated question I've ever seen, on any site","2013-01-01 22:04:44","","1654265"
"19533788","14114419","0","@all Please note this won't work with UTF-8","2013-01-01 22:11:07","","1208233"
"19533825","14114480","0","@AndreaLigios I've had to answer a far few, I should know the rules and how to ""ask a decent question"" :p","2013-01-01 22:13:02","","588306"
"19533849","14114480","0","@Deanna when you create the keystore, should you have -trustedcacerts in the options so that it will validate the cert using the trusted certs? (neve worked with BKS guessing based on core java similarities)","2013-01-01 22:14:12","","465582"
"19533867","14114419","0","@metal_fan what would that mean... i mean how bad can it be?","2013-01-01 22:15:21","","2321939"
"19533987","14114480","0","@Deanna apologies, typo. Should be -trustcacerts. Hopefully this works, if not I'll leave it to people who have actually used BKS","2013-01-01 22:22:47","","465582"
"19534050","14114786","1","oooo ,It's just a dumb questions , haha :) Thank you so much, I will accept your answer as soon as possible :)","2013-01-01 22:27:50","","1022209"
"19534196","14114443","0","No problem :-), and he also *did* wrap the code in a function, which I did not.","2013-01-01 22:37:28","","1428679"
"19534302","14114480","0","I've tried adding and trusting the two CA certs above it to the keystore too but with the same result :|.","2013-01-01 22:45:54","","588306"
"19534473","14114741","2","That's a really good point.  Someone should point that out to Kenneth Reitz--or maybe submit a pull request to the project?","2013-01-01 22:56:55","","1351335"
"19534589","14112064","3","There are actually HUGE differences between PostScript and PDF. Calling PostScript PDF with compression on top is not giving much credit to either language. The biggest difference perhaps is that PostScript is a true programming language, while PDF is not. That is an enormous difference and explains why PDF is the format used (there are clearly other reasons too) today while PostScript is going away.","2013-01-01 23:04:11","","1682924"
"19534616","14112064","0","Perhaps sloppy use of language - it is BASED on PostScript, and you need a pretty good part of a PostScript interpreter to implement PDF rendering - at least that is my understanding, if you can explain it better, feel free to write a better answer.","2013-01-01 23:06:17","","1919155"
"19534668","14112532","6","You CAN'T avoid this by using the braces, because an accidental semicolon after the close paren, and before the open brace, is a syntactically valid program ... and probably not what you wanted.  I agree however that a code for matter might help avoid this problem.","2013-01-01 23:09:38","","1758051"
"19534751","14112064","2","No, you actually don't. The problem with PostScript is that it is in fact a programming language and you need code that will execute the program (that every PostScript file is) and allow it to generate its output. PDF is much, much simpler and contains only very simple instructions like ""move text origin"", ""draw rectangle"", ""set fill color"", ""set font""... It's a really a different animal altogether. (and I just finished writing a background answer on the specification that should help him :))","2013-01-01 23:15:16","","1682924"
"19534801","14112064","0","OK, fair enough. Wikipedia has it wrong. But we both agree on the fact that it's a pretty poor idea to try to implement your own PDF code, which is the main point of what I write.","2013-01-01 23:19:03","","1919155"
"19535098","14115314","0","I believe it's `-pthread` and `-std=c++11`","2013-01-01 23:44:01","","1381108"
"19535210","14115375","4","Jquery supports more complex selectors, as well as it supports BC to the old browsers.","2013-01-01 23:55:41","","251311"
"19535211","14115375","8","jQuery uses Sizzle as selector engine which provides all sorts of extensions to the ""normal"" CSS selectors. `document.querySelector()` is not supported in IE6 and IE7 (I think). Related (maybe): [John Resig - Thoughts on querySelectorAll](http://ejohn.org/blog/thoughts-on-queryselectorall/).","2013-01-01 23:55:46","","218196"
"19535223","14115375","0","Oh, so could I still do nested selectors like `document.querySelector(""#myId .myNested .mySpan p"")`? Or is that what you mean by ""complex selectors""?","2013-01-01 23:56:57","","1672778"
"19535236","14115375","0","@ModernDesigner: how about `:eq(n)` and, say, `:parent`?","2013-01-01 23:58:28","","251311"
"19535237","14115375","0","@Modern: Any CSS selector is supported by `querySelector` afaik and this is one. It's not a ""nested"" selector though, it's the descendant selector applied multiple times.","2013-01-01 23:58:28","","218196"
"19535254","14115375","0","@zerkms, than what do you mean by ""complex selectors""?","2013-01-01 23:59:39","","1672778"
"19535267","14115375","0","@ModernDesigner: I meant selectors that aren't part of specification, but which make life easier. `:selected` is another good example","2013-01-02 00:00:56","","251311"
"19535274","14115375","0","Oh, okay! Thanks! :-)","2013-01-02 00:01:41","","1672778"
"19535278","14115375","4","From what I can see, `querySelector()` only returns the first match, whereas jQuery returns all elements it can match.","2013-01-02 00:01:53","","234932"
"19535287","14115375","0","Oouch! Well that would be a deal breaker. Hehe.","2013-01-02 00:02:25","","1672778"
"19535359","14111686","0","A quote from the JLS would get you a +1 (if I can find one I'll add it later).","2013-01-02 00:08:39","","476716"
"19535369","14114741","1","@jdotjdot: Something like `requests.get(...).save('file.txt')`?","2013-01-02 00:09:39","","464744"
"19535420","14115375","0","@ModernDesigner: Well, some of the time yeah. :)","2013-01-02 00:13:54","","234932"
"19535438","14111021","0","Its NHibernate based. Don't you got any examples using EF? And again when I need to call another entity how is that made best in the static extension method?","2013-01-02 00:15:27","","148601"
"19535683","14113691","5","This sort of diagram flunks the Tufte test.  Too much ink for too little info.  Worse, it's difficult to tell whether one car, e.g., is worth more than one train.","2013-01-02 00:33:33","","884372"
"19535919","14114741","3","Just a note--in the latest versions of requests, the prefetch arg has been changed to stream. So stream=True would be used here.","2013-01-02 00:54:37","","1695245"
"19535966","14115406","0","+1, but usage example is unnecessary.  As you show it can be used, but it's far from the best way to organize that code.  It's ugly, but there's no reason to special case it in order to reject -- at least from the compiler's POV. From a stle POV...","2013-01-02 00:58:52","","234954"
"19535988","14111686","0","Please do.  I'm not interested in looking.","2013-01-02 01:01:44","","37213"
"19536005","14115375","9","@bvukelic: That's why there's `querySelectorAll`.","2013-01-02 01:03:19","","200291"
"19536015","14115375","0","So that would match all elements... ? :)","2013-01-02 01:04:27","","1672778"
"19536022","14115375","0","Yes, `querySelectorAll` will return a list of all elements that match the selector. The main downside of `querySelectorAll` (and `querySelector`) in my view is that it's not supported by older browsers.","2013-01-02 01:05:01","","200291"
"19536078","14115375","2","What there is ""non-constructive"" of requesting finite number of differences of `.querySelector` vs. `$`?","2013-01-02 01:10:11","","936986"
"19536147","14115620","2","This article it may help you : http://msdn.microsoft.com/en-us/magazine/gg598924.aspx","2013-01-02 01:16:16","","159270"
"19536151","14114480","0","So the error is occurring on Windows 8? Or on the android device?","2013-01-02 01:16:46","","238704"
"19536158","14112549","0","+1, most clear and concise explanation of why it is this way without presuming knowledge.","2013-01-02 01:17:37","","180736"
"19536194","14113691","1","true may be good in science journal, but still may be useful in house / parliament floor, business meeting or general public meetings.","2013-01-02 01:20:18","","1368828"
"19536268","14115902","7","`{} != ({})` is a syntax error.","2013-01-02 01:26:16","","1917390"
"19536322","14115620","1","Thanks. Definitely a good read, although it doesn't answer my question.","2013-01-02 01:30:43","","46926"
"19536323","14115902","0","`1` and `{}` are quite different beasts.","2013-01-02 01:30:46","","560648"
"19536345","14115902","0","By the way the same applies to arrays for similar reasons (because arrays are also objects): `[] != []` is true.","2013-01-02 01:33:06","","567595"
"19536393","14115902","0","Check out [Bizzare Javascript Behaviours](http://stackoverflow.com/questions/9032856/what-is-the-explanation-for-these-bizarre-javascript-behaviours-mentioned-in-the), with its [amazingly detailed answer](http://stackoverflow.com/questions/9032856/what-is-the-explanation-for-these-bizarre-javascript-behaviours-mentioned-in-the#answer-9033306).","2013-01-02 01:37:33","","825568"
"19536458","14116003","1","There was actually [an article](http://isocpp.org/blog/2012/12/using-constexpr) on this posted not too long ago.","2013-01-02 01:42:58","","962089"
"19536469","14116003","0","thanks for one, but I'm looking for a more comprehensive answer :)","2013-01-02 01:43:35","","395573"
"19536484","14116003","7","`constexpr` creates a compile-time constant; `const` simply means that value cannot be changed.","2013-01-02 01:44:46","","701092"
"19536521","14114741","1","Fantastic. Thank you for explaining the correlation to urllib as well.","2013-01-02 01:49:29","","197663"
"19536807","14113278","0","Also check out my library https://bitbucket.org/ytkyaw/ydn-db/wiki/Home","2013-01-02 02:16:37","","824275"
"19537001","14115349","0","This doesn't work for me. See my edit for the error message that I am now getting.","2013-01-02 02:34:19","","2874"
"19537007","14112929","0","@MattiVirkkunen - most ORM frameworks automatically map link tables, aka there are no physical entities created to represent them.","2013-01-02 02:34:37","","680925"
"19537114","14112064","0","@MatsPetersson: Please do not answer a technical question on StackOverflow by (badly) quoting or referring to Wikipedia. Nothing good in favor of your reputation can come from this... I'd even like to ask you to delete your above answer -- it is so utterly wrong and can lead people down the wrong path!","2013-01-02 02:44:47","","359307"
"19537178","14111831","2","@all_those_who_vote_to_close_question_as_not_constructive (Daniel Fischer, Flexo, C. Ross, Bo Persson, Matthew Lundberg): this question was a very valid one, and closing it was in fact very unconstructive.  And the justification you picked for it is ridiculous. None of you has so far collected any significant reputation points with [pdf] -- so why do you not leave this question to people who know the topic better than you?!?","2013-01-02 02:52:12","","359307"
"19537232","14115349","3","You are not using the system clang, you're using the homebrew clang. For whatever reason, it's looking for libc++ at /usr/include/c++/v1, which is the location they recommend to install it on linux. On OS X, it's stored in /usr/lib/c++/v1, which is where the system clang would look.","2013-01-02 02:58:58","","47453"
"19537239","14115349","0","Yes, I mentioned that in my comment. Can I not use libc++ and homebrew clang?","2013-01-02 02:59:51","","2874"
"19537270","14115349","0","It appears that the homebrew build scripts don't allow you to fix the location of the libc++ libraries...","2013-01-02 03:02:58","","47453"
"19537277","14115349","0","Thanks for pointing that out, using the system clang results in everything working fine.","2013-01-02 03:04:03","","2874"
"19537281","14116420","0","AFAIK, `-lmylib`.","2013-01-02 03:04:13","","962089"
"19537347","14116420","0","@chris I have made the question more clear -lmylib does not change the situation","2013-01-02 03:11:48","","989331"
"19537379","14116420","2","The static s may be initialized anywhere from before main until the first call to a function within that translation unit... that means that never instantiating s is valid according to the standard, given that no function from that translation unit is ever called.","2013-01-02 03:15:08","","927034"
"19537387","14116420","0","+1, I ran into exactly the same situation a couple of weeks ago. I had some small libraries and a bigger one using all smaller ones (well, not necessarily by calling methods of them; it ""bundled"" them together). The final application should then use the bigger library as well as the smaller ones ""bundled"" with it, but they weren't there, because the bigger one didn't use them. I did a workaround by introducing a dummy method in the small libraries and used them in the bigger one... Dirty hack! :\ I'm looking forward to see a good answer to this question :)","2013-01-02 03:15:41","","592323"
"19537437","14116420","0","@K-ballo but the constructor S::S() *is* called from the translation unit which defines S . Or am I missing something in your comment?","2013-01-02 03:21:13","","989331"
"19537446","14116420","2","You are missing the fact that a perfectly conformant implementation can instantiate its globals right before the first function from that translation unit is called, which in your case is never...","2013-01-02 03:22:32","","927034"
"19537507","14114741","1","@Blender I'm thinking more like `requests.get(...).save_as('file.jpg')`--want to make it as obvious as possible what's going on, and ""save as"" is more associated with a possible change in filename.  Additionally, maybe a `stream=False` argument or something similar.","2013-01-02 03:29:44","","1351335"
"19538008","14109036","0","yes #import <QuartzCore/QuartzCore.h> and also include CoreImage & QuartzCore Frameworks","2013-01-02 04:19:55","","1099453"
"19538042","14109036","0","okay...tanks :)","2013-01-02 04:22:58","","1917782"
"19538154","14112582","2","Code like this can actually prevent errors in logic by accounting for all cases.  ""If true do nothing, else..."" can be more readable since you don't get confused by negation mistakes and a ""missing case"".  Most compilers these days are aware of this construct and invert for you anyway for a speed improvement.  e.g. The Mercury language enforces this!","2013-01-02 04:33:54","","1327079"
"19538486","14113596","0","Thanks Michael, I edited the question and have put another code which worked for me, so just wondering what is the difference in using Select and collection_select as mentioned in below answers ?","2013-01-02 05:01:14","","692622"
"19538824","14117121","0","IMO the ""not necessarily evaluated at compile time"" is less helpful than thinking of them as ""evaluated at compile time"".  The constraints on a constant expression mean that it would be relatively easy for a compiler to evaluate it.  A compiler must complain if those constraints are not satisfied.  Since there are no side effects, you can never tell a difference whether a compiler ""evaluated"" it or not.","2013-01-02 05:27:01","","459640"
"19538934","14117121","2","@aschepler Sure. My main point there is that if you call a `constexpr` function on a non-constant expression, e.g. an ordinary variable, this is perfectly legal and the function will be used like any other function. It will not be evaluated at compile time (because it can't). Perhaps you think that's obvious -- but if I stated that a function declared as `constexpr` will always be evaluated at compile-time, it could be interpreted in the wrong way.","2013-01-02 05:34:47","","777186"
"19539004","14117121","1","Yes, I was talking about `constexpr` objects, not functions.  I like to think of `constexpr` on objects as forcing compile time evaluation of values, and `constexpr` on functions as allowing the function to be evaluated at compile time or run time as appropriate.","2013-01-02 05:38:50","","459640"
"19539060","14117121","0","That's true. Good comment.","2013-01-02 05:42:41","","777186"
"19539636","14117348","1","Thank you, wow that was under 20 minutes to get an answer :) !","2013-01-02 06:22:42","","212012"
"19539958","14117348","2","You're welcome :) This Q just happened to be there when I was doing my periodic rounds - you wont always be that lucky :)","2013-01-02 06:42:32","","85785"
"19540189","14109166","0","It's just that I had a chain of thought. After that i realized that there is no ideal. Now I would like to evaluate the likelihood of problems by following the advice of algirdas. I've found one: ipython (interactive console for developing in Python) refuses to run in Unicode console. Where can i expect more problems?","2013-01-02 06:56:58","","1251169"
"19541799","14112532","1","have to vote for this joint red bug .... +1 (and nice answer )","2013-01-02 08:38:02","","1723893"
"19541856","14114480","0","@GregS The erorr is occuring on the Android device. Windows 8 is used for development and to create the key store.","2013-01-02 08:41:36","","588306"
"19541889","14116462","0","I'm already using 1.45 (I used 1.47 initially, see the question) will 1.46 make a difference? Bear in mind that I'm currently targetting Android 2.3 that seems to use 1.45.","2013-01-02 08:43:35","","588306"
"19542380","14119294","1","thank you for your quick answer!","2013-01-02 09:10:42","","1218067"
"19542449","14119294","0","@MehmetBudak, you are welcome","2013-01-02 09:13:23","","961113"
"19542670","14119297","0","thank you for your answer!","2013-01-02 09:23:55","","1218067"
"19543278","14116420","0","You can create a script on bash for selecting libraries what you want to use.","2013-01-02 09:49:28","","1929959"
"19543894","14112532","1","+1 a nice answer and a big Giant _Trademarked_ Bug. :D","2013-01-02 10:15:12","","1423083"
"19543958","14120223","0","Is this different from [Why would one replace default new and delete operators?](http://stackoverflow.com/questions/7149461/why-would-one-replace-default-new-and-delete-operators). The Q asked in title is answered by the linked answer. But your Q detail asks another specific Q. Both are quite distinct Q's.","2013-01-02 10:17:42","","452307"
"19543990","14120223","0","@AlokSave The default ones are different from member ones, so yes. This is about the specific case when a special `operator delete`, not the default one, is chosen by a virtual destructor.","2013-01-02 10:18:59","","153285"
"19544000","14115911","1","Aren't you supposed to use `===` in Javascript to check on references?","2013-01-02 10:19:32","","344945"
"19544024","14120223","0","@AlokSave Oh, I see. Since that answer (and others there) is a bit long, maybe you could copy over the parts that are relevant to this Q?","2013-01-02 10:20:30","","153285"
"19544027","14120223","0","The same reasons do hold good for member overloads as well. No? Guess you saw it after your first comment and while I was writing this comment.This comment needs to go..It will in sometime.","2013-01-02 10:20:33","","452307"
"19544030","14115911","2","@Kevin: `===` is about types. Objects are always compared by references","2013-01-02 10:20:41","","251311"
"19544080","14120223","1","@AlokSave Well, no. Overriding the global one means getting a new/better overall allocation algorithm. Overloading class-specific ones means making different classes do different things, perhaps calling through to the global one. I'm asking about the case where a derived class does something different from its base, which is yet more specific, yet has dedicated semantic machinery in the language spec.","2013-01-02 10:22:47","","153285"
"19544151","14120223","0","I understand but Overloading class specific ones is also possible for collecting usage statistics, usability errors and so on. Which may not be motivation for doing something special(*as you rightly pointed out*) but yet useful sometimes.","2013-01-02 10:25:10","","452307"
"19544385","14120223","0","@AlokSave Sounds plausible, but to be an answer, we'd still need to contrive a diagnostic that relies on dispatching to a specific `operator delete` in this way.","2013-01-02 10:33:48","","153285"
"19544496","14115300","0","""This code is useful"" <- How could it be useful to ignore the result of a condition?","2013-01-02 10:37:56","","1389219"
"19544819","14120721","1","thanks, i used this way
`18] pry(main)> Date.new(2012,11,-1)
=> Fri, 30 Nov 2012`","2013-01-02 10:49:55","","1600336"
"19545136","14120721","0","Already done....","2013-01-02 11:01:20","","1600336"
"19545208","14120721","0","one more question, is there any way to get amount of days in month?","2013-01-02 11:03:54","","1600336"
"19545305","14120711","0","Maybe it's a `NOP`? Does it end at the same address?","2013-01-02 11:07:27","","249230"
"19545413","14120721","0","Yes you can use `Date.new(year, month, -1).day` well I know you can understand the parameters already =)","2013-01-02 11:11:47","","877819"
"19545491","14116462","0","Hmmm, I did not try with 1.45 version but I can say that your project successfully loads keystore created by 1.46 version.","2013-01-02 11:14:41","","183915"
"19545738","14120711","0","The number 1234567 is the real result, or a mock-up number for illustrative purposes?","2013-01-02 11:26:53","","1284631"
"19546120","14115980","1","Your java code goes to 2-18 whereas the Clojure code goes to 2-20.","2013-01-02 11:43:45","","553209"
"19546968","14120227","0","What do you do for service layer?","2013-01-02 12:16:48","","148601"
"19548753","14118242","0","thanks it will go right to floor @fpdr thanks for asking","2013-01-02 13:21:57","","1368828"
"19549175","14118242","0","@shNIL I am surprised  that they ask for such diagram!","2013-01-02 13:36:07","","1838509"
"19549785","14112515","0","@gefei : _there is no situation for this to be useful_, true. But there can be situation(s) where this can(or be used to) impact the program. please see my answer.","2013-01-02 13:58:40","","1423083"
"19549821","14120711","0","My first guess would be that you aren't looking at the System.map file which correspond to the running kernel.","2013-01-02 13:59:59","","136208"
"19550029","14120227","0","Controllers query repo for read-only data, why add some extra layer? The other possibility is using ""ContentService"" which more and more tends to be a service-level-repository: GetXByY, etc.etc. For modification operations - application services are just abstractions over use cases - they use BL and repo freely..","2013-01-02 14:08:09","","731115"
"19550092","14120711","0","Not sure why you get the same output for the three different lines of code.","2013-01-02 14:11:14","","412080"
"19550402","14114450","1","These two blob are different. Sqlite blob is arraybuffer in javascript, while js blob has no equivalent in sqlite. Blob cannot convert to arraybuffer, although it can be structurally cloned.","2013-01-02 14:24:11","","824275"
"19550619","14120711","0","@MaximYegorushkin: at least for the last two LOCs, this is explainable: the same would have happen if tasklest_action would have been defined as an array: char tasklet_action[10]; normally, only tasklet_action should mean the address, but compilers (gcc) usually give &tasklet_action the same value (the address); a bit unsure why, still (as &tasklet_action should bear no more meaning than &3.0)... as for the dereferenced tasklet_action, indeed it is a bit strange.","2013-01-02 14:33:27","","1284631"
"19550855","14120227","0","I'm used to do service layer for business logic. I'm not really sure I follow what you with ContentService, please elaborate. Would it be bad practice to do helper classes as ""service layer""?","2013-01-02 14:42:31","","148601"
"19551451","14120711","1","What architecture are you running the kernel on?","2013-01-02 15:04:35","","1057909"
"19552421","14112534","2","@Gumbo - Are you sure that works? My Java is rusty but I couldn't get a() && b() to work: http://ideone.com/beVwPe","2013-01-02 15:41:16","","453277"
"19553222","14120711","0","@axeoth: An expression of function type (such as a function name) decays to a pointer to the function in most contexts, but not when it's an operand of unary `&`. So `func`, `&func`, and `*func`, as well as `**func` and `***func`, all have the same type and value, namely the address of `func`. There's nothing compiler-specific about it; the C language defines it that way. But the OP's question is why the address he's seeing doesn't match the one in `System.map`.","2013-01-02 16:10:25","","827263"
"19553511","14112534","2","@TimMedora My fault, I mixed something up (i.e. *Assignment* and *AssignmentExpression* production rules) and havent actually tested it (probably because other languages allow such statements). A *Statement* allows only the former *Assignment* while the mentioned expression `a() && b()` would be an *AssignmentExpression*.","2013-01-02 16:21:25","","53114"
"19554353","14125030","1","(+1) Out of interest, what exactly is the ""mode"" encoded by the bottom bit?","2013-01-02 16:49:12","","367273"
"19554523","14116462","0","Here it is : http://dl.dropbox.com/u/26734922/keystore","2013-01-02 16:55:26","","183915"
